<!-- 
Nombre: Kaiet de Pablo
Curso: ASIR
Fecha: 03/04/2025
Ejercicio: Aeropuerto
-->
<!DOCTYPE panel_vuelos SYSTEM "panel_vuelos.dtd">
<panel_vuelos>
    <nombre_aeropuerto>JFK</nombre_aeropuerto>
    <fecha>20/12/2013</fecha>
    
    <vuelo codigo="V22" estado="R">
        <diario>SI</diario>
        <origen>New York</origen>
        <destino>Chicago</destino>
        <hora_salida>9:30</hora_salida>
        <hora_llegada>11:30</hora_llegada>
        <es_salida/>
    </vuelo>

    <vuelo codigo="V23" estado="C">
        <diario>NO</diario>
        <origen>New York</origen>
        <destino>Miami</destino>
        <hora_salida>10:15</hora_salida>
        <hora_llegada>11:15</hora_llegada>
        <es_salida/>
    </vuelo>
</panel_vuelos>